{
  "$schema": "https://json-schema.org/draft/2020-12/schema",
  "$id": "https://inspireacademic.org/resources/itt/ITT_Quiz_Schema_v1.json",
  "title": "Inspire Test & Teach quiz package (itt.quiz.v1)",
  "description": "One complete, self-describing Test & Teach quiz: sections in teaching order, questions, correct answers, and a teaching explanation for every possible response. The Inspire Academic importer accepts any file that satisfies this schema and the additional rules listed in ITT_Quiz_Authoring_Standard_v1.md (unique ids, valid references, feedback that teaches). Order is given by position: sections are delivered in array order, and questions in the order they appear inside their section. Text fields are plain text; mathematics and chemistry are LaTeX between \\( and \\) (inline) or \\[ and \\] (display). HTML is never allowed.",
  "type": "object",
  "required": ["schema", "package", "objectives", "topics", "sections"],
  "properties": {
    "schema": { "const": "itt.quiz.v1", "description": "Always exactly \"itt.quiz.v1\"." },
    "package": { "$ref": "#/$defs/package" },
    "objectives": {
      "description": "The learning objectives this package teaches and assesses. Every question refers to at least one.",
      "type": "array", "minItems": 1,
      "items": { "$ref": "#/$defs/objective" }
    },
    "topics": {
      "description": "The topics covered, e.g. one per line of the school's topic list.",
      "type": "array", "minItems": 1,
      "items": { "$ref": "#/$defs/topic" }
    },
    "assets": {
      "description": "Optional images (diagrams, graphs), embedded in the file. Questions refer to them by id.",
      "type": "array",
      "items": { "$ref": "#/$defs/asset" }
    },
    "settings": {
      "type": "object",
      "properties": {
        "retries": { "$ref": "#/$defs/retries" }
      }
    },
    "sections": {
      "description": "The sections, in the order students work through them.",
      "type": "array", "minItems": 1, "maxItems": 40,
      "items": { "$ref": "#/$defs/section" }
    }
  },
  "$defs": {
    "id": {
      "description": "A short, stable identifier: letters, digits, dot, underscore, hyphen.",
      "type": "string", "pattern": "^[A-Za-z0-9][A-Za-z0-9._-]{0,63}$"
    },
    "text": {
      "description": "Plain text. LaTeX between \\( \\) or \\[ \\]. **bold** and blank-line paragraphs allowed. No HTML.",
      "type": "string", "minLength": 1, "maxLength": 6000
    },
    "feedbackText": {
      "description": "A teaching explanation shown to the student who gave this response. It must explain the reasoning in at least one full sentence; a bare verdict such as \"Correct.\" is refused.",
      "type": "string", "minLength": 30, "maxLength": 6000
    },
    "retries": {
      "description": "How many times a student may try a question again after reading the feedback for a wrong or not-sure response. 0 means one attempt only. The first attempt is always kept.",
      "type": "integer", "minimum": 0, "maximum": 3
    },
    "package": {
      "type": "object",
      "required": ["id", "title", "description", "subject", "year_group", "author", "created", "content_version"],
      "properties": {
        "id": { "description": "Lower-case identifier that stays the same across revisions of this package, e.g. \"y10-chem-structure-bonding\".", "type": "string", "pattern": "^[a-z0-9][a-z0-9-]{2,79}$" },
        "title": { "type": "string", "minLength": 1, "maxLength": 160 },
        "description": { "$ref": "#/$defs/text" },
        "subject": { "type": "string", "minLength": 1, "maxLength": 60 },
        "year_group": { "description": "e.g. \"Year 10\".", "type": "string", "minLength": 1, "maxLength": 40 },
        "exam_board": { "type": "string", "maxLength": 60 },
        "tier": { "description": "e.g. \"Higher\", \"Foundation\".", "type": "string", "maxLength": 40 },
        "specification": { "description": "Curriculum or specification reference.", "type": "string", "maxLength": 300 },
        "author": {
          "type": "object",
          "required": ["source"],
          "properties": {
            "source": { "description": "Who or what wrote the package, e.g. \"ChatGPT\".", "type": "string", "minLength": 1, "maxLength": 80 },
            "model": { "type": "string", "maxLength": 80 },
            "notes": { "type": "string", "maxLength": 600 }
          }
        },
        "created": { "description": "ISO date, e.g. \"2026-10-08\".", "type": "string", "pattern": "^\\d{4}-\\d{2}-\\d{2}(T[\\d:.]+(Z|[+-]\\d{2}:\\d{2})?)?$" },
        "content_version": { "description": "The author's version label, e.g. \"1.0.0\". Change it whenever the content changes.", "type": "string", "minLength": 1, "maxLength": 40 },
        "estimated_minutes": { "type": "integer", "minimum": 1, "maximum": 3000 }
      }
    },
    "objective": {
      "type": "object",
      "required": ["id", "text"],
      "properties": {
        "id": { "$ref": "#/$defs/id" },
        "text": { "type": "string", "minLength": 1, "maxLength": 600 }
      }
    },
    "topic": {
      "type": "object",
      "required": ["id", "title"],
      "properties": {
        "id": { "$ref": "#/$defs/id" },
        "title": { "type": "string", "minLength": 1, "maxLength": 600 },
        "description": { "type": "string", "maxLength": 1200 }
      }
    },
    "asset": {
      "type": "object",
      "required": ["id", "media_type", "data", "alt"],
      "properties": {
        "id": { "$ref": "#/$defs/id" },
        "media_type": { "enum": ["image/png", "image/jpeg", "image/webp", "image/gif", "image/svg+xml"] },
        "data": { "description": "The image bytes, base64-encoded, without a \"data:\" prefix. At most 400 KB per image and 3 MB per package. SVG must not contain scripts.", "type": "string", "pattern": "^[A-Za-z0-9+/]+={0,2}$" },
        "alt": { "description": "A full description of the image for students who cannot see it.", "type": "string", "minLength": 1, "maxLength": 600 },
        "caption": { "type": "string", "maxLength": 600 }
      }
    },
    "section": {
      "type": "object",
      "required": ["id", "title", "description", "type", "purpose", "topic_ids", "objective_ids", "questions"],
      "properties": {
        "id": { "$ref": "#/$defs/id" },
        "title": { "type": "string", "minLength": 1, "maxLength": 160 },
        "description": { "$ref": "#/$defs/text" },
        "type": {
          "description": "The section's role. \"mastery\" marks an independent mastery check: one attempt per question, and its results are reported separately from teaching questions.",
          "enum": ["foundation", "conceptual", "practice", "application", "misconceptions", "review", "mastery"]
        },
        "purpose": { "description": "The intended learning purpose of the section, in a sentence.", "type": "string", "minLength": 1, "maxLength": 600 },
        "estimated_minutes": { "type": "integer", "minimum": 1, "maximum": 600 },
        "topic_ids": { "type": "array", "minItems": 1, "items": { "$ref": "#/$defs/id" } },
        "objective_ids": { "type": "array", "minItems": 1, "items": { "$ref": "#/$defs/id" } },
        "requires": {
          "description": "Ids of EARLIER sections that must be completed before this one opens. Omit for no gating.",
          "type": "array", "items": { "$ref": "#/$defs/id" }
        },
        "retries": { "$ref": "#/$defs/retries" },
        "questions": {
          "description": "The questions, in the order students meet them.",
          "type": "array", "minItems": 1,
          "items": { "$ref": "#/$defs/question" }
        }
      }
    },
    "question": {
      "oneOf": [
        { "$ref": "#/$defs/mcq" },
        { "$ref": "#/$defs/true_false" },
        { "$ref": "#/$defs/numeric" },
        { "$ref": "#/$defs/short_text" }
      ]
    },
    "questionCommon": {
      "type": "object",
      "required": ["id", "type", "stem", "marks", "difficulty", "objective_ids", "not_sure"],
      "properties": {
        "id": { "description": "Unique across the whole package, e.g. \"s2-q07\". Never reuse or renumber ids between revisions.", "$ref": "#/$defs/id" },
        "stem": { "$ref": "#/$defs/text" },
        "marks": { "type": "integer", "minimum": 1, "maximum": 20 },
        "difficulty": { "enum": ["foundation", "standard", "challenge"] },
        "purpose": { "description": "Optional. \"mastery\" is only allowed, and is implied, in a section of type \"mastery\".", "enum": ["teach", "practice", "mastery"] },
        "objective_ids": { "type": "array", "minItems": 1, "items": { "$ref": "#/$defs/id" } },
        "topic_ids": { "type": "array", "items": { "$ref": "#/$defs/id" } },
        "asset_ids": { "description": "Images shown with the question.", "type": "array", "items": { "$ref": "#/$defs/id" } },
        "not_sure": {
          "description": "The platform adds an \"I'm not sure\" response to every question. This is the teaching explanation a student sees after choosing it.",
          "type": "object",
          "required": ["feedback"],
          "properties": { "feedback": { "$ref": "#/$defs/feedbackText" } }
        },
        "teaching_note": { "description": "A general explanation of the concept, shown in a supplementary panel once the question is settled.", "$ref": "#/$defs/text" },
        "worked_solution": { "description": "The full method, shown once the question is settled.", "$ref": "#/$defs/text" }
      }
    },
    "mcq": {
      "description": "Single-answer multiple choice.",
      "type": "object",
      "allOf": [{ "$ref": "#/$defs/questionCommon" }],
      "required": ["options", "answer"],
      "properties": {
        "type": { "const": "mcq" },
        "options": {
          "description": "2 to 6 options, shown in this order. Do not include an \"I'm not sure\" option.",
          "type": "array", "minItems": 2, "maxItems": 6,
          "items": {
            "type": "object",
            "required": ["id", "text", "feedback"],
            "properties": {
              "id": { "description": "e.g. \"A\".", "type": "string", "pattern": "^[A-Za-z0-9]{1,8}$" },
              "text": { "type": "string", "minLength": 1, "maxLength": 1200 },
              "feedback": { "$ref": "#/$defs/feedbackText" },
              "misconception": { "description": "For a wrong option: a short label for the misconception it reveals.", "type": "string", "maxLength": 200 }
            }
          }
        },
        "answer": { "description": "The id of the ONE correct option.", "type": "string", "pattern": "^[A-Za-z0-9]{1,8}$" }
      }
    },
    "true_false": {
      "type": "object",
      "allOf": [{ "$ref": "#/$defs/questionCommon" }],
      "required": ["answer", "feedback"],
      "properties": {
        "type": { "const": "true_false" },
        "answer": { "description": "true or false, as a JSON boolean.", "type": "boolean" },
        "feedback": {
          "type": "object",
          "required": ["true", "false"],
          "properties": {
            "true": { "description": "Shown to a student who answers True.", "$ref": "#/$defs/feedbackText" },
            "false": { "description": "Shown to a student who answers False.", "$ref": "#/$defs/feedbackText" }
          }
        }
      }
    },
    "numeric": {
      "description": "The student types a number. Marked exactly, or within the stated tolerance.",
      "type": "object",
      "allOf": [{ "$ref": "#/$defs/questionCommon" }],
      "required": ["answer", "feedback"],
      "properties": {
        "type": { "const": "numeric" },
        "answer": {
          "type": "object",
          "required": ["value"],
          "properties": {
            "value": { "type": "number" },
            "tolerance": {
              "description": "absolute: within ±value of the answer. relative: within that fraction of the answer (0.02 = 2%). Omit for an exact answer.",
              "type": "object",
              "required": ["type", "value"],
              "properties": {
                "type": { "enum": ["absolute", "relative"] },
                "value": { "type": "number", "exclusiveMinimum": 0 }
              }
            },
            "unit": { "description": "Shown beside the answer box. The student types the number only.", "type": "string", "maxLength": 30 }
          }
        },
        "feedback": { "$ref": "#/$defs/correctIncorrect" },
        "wrong_answers": {
          "description": "Specific wrong numbers produced by known mistakes, each with its own explanation.",
          "type": "array",
          "items": {
            "type": "object",
            "required": ["value", "feedback"],
            "properties": {
              "value": { "type": "number" },
              "feedback": { "$ref": "#/$defs/feedbackText" },
              "misconception": { "type": "string", "maxLength": 200 }
            }
          }
        }
      }
    },
    "short_text": {
      "description": "The student types a word or short phrase, marked against an explicit list. Ignores case, surrounding spaces and a final full stop.",
      "type": "object",
      "allOf": [{ "$ref": "#/$defs/questionCommon" }],
      "required": ["answer", "feedback"],
      "properties": {
        "type": { "const": "short_text" },
        "answer": {
          "type": "object",
          "required": ["accepted"],
          "properties": {
            "accepted": { "description": "Every exact answer that should be marked right.", "type": "array", "minItems": 1, "items": { "type": "string", "minLength": 1, "maxLength": 80 } },
            "case_sensitive": { "type": "boolean" }
          }
        },
        "feedback": { "$ref": "#/$defs/correctIncorrect" },
        "wrong_answers": {
          "type": "array",
          "items": {
            "type": "object",
            "required": ["accepted", "feedback"],
            "properties": {
              "accepted": { "type": "array", "minItems": 1, "items": { "type": "string", "minLength": 1, "maxLength": 80 } },
              "feedback": { "$ref": "#/$defs/feedbackText" },
              "misconception": { "type": "string", "maxLength": 200 }
            }
          }
        }
      }
    },
    "correctIncorrect": {
      "type": "object",
      "required": ["correct", "incorrect"],
      "properties": {
        "correct": { "description": "Shown for a right answer. Must explain why it is right.", "$ref": "#/$defs/feedbackText" },
        "incorrect": { "description": "Shown for any wrong answer not listed in wrong_answers.", "$ref": "#/$defs/feedbackText" }
      }
    }
  }
}
