{
  "schema": "itt.quiz.v1",
  "package": {
    "id": "itt-notation-fixture",
    "title": "ITT Notation Fixture: formulae, ions, equations and maths",
    "description": "A technical fixture for checking scientific typesetting. It carries a formula such as \\(\\mathrm{Al_2O_3}\\), ions such as \\(\\mathrm{Mg^{2+}}\\) and \\(\\mathrm{O^{2-}}\\), a balanced equation, a fraction, a square root and standard form through every part of a question.",
    "subject": "Chemistry",
    "year_group": "Year 10",
    "exam_board": "AQA",
    "tier": "Higher",
    "author": {
      "source": "Inspire Academic",
      "notes": "Written by hand for rendering tests. Import it to see how notation looks before approving real content."
    },
    "created": "2026-10-09",
    "content_version": "1.0.0",
    "estimated_minutes": 10
  },
  "objectives": [
    {
      "id": "LO1",
      "text": "Read and write formulae and ions such as \\(\\mathrm{Al_2O_3}\\) and \\(\\mathrm{Mg^{2+}}\\)."
    },
    {
      "id": "LO2",
      "text": "Use fractions, roots and standard form, for example \\(6.02\\times10^{23}\\), in calculations."
    }
  ],
  "topics": [
    {
      "id": "notation",
      "title": "Chemical notation",
      "description": "Formulae, ionic charges and balanced equations."
    },
    {
      "id": "maths",
      "title": "Mathematical notation",
      "description": "Fractions, powers, roots, standard form and units."
    }
  ],
  "settings": {
    "retries": 0
  },
  "sections": [
    {
      "id": "s1",
      "title": "Notation in every part of a question",
      "description": "Each question puts notation somewhere different: the question, the choices, the feedback, the key idea and the worked solution. For example, magnesium burns in oxygen:\n\n\\[2\\mathrm{Mg}+\\mathrm{O_2}\\rightarrow2\\mathrm{MgO}\\]",
      "type": "practice",
      "purpose": "Show formulae, ions, equations and calculations in each field the player typesets.",
      "estimated_minutes": 7,
      "topic_ids": [
        "notation",
        "maths"
      ],
      "objective_ids": [
        "LO1",
        "LO2"
      ],
      "retries": 1,
      "questions": [
        {
          "id": "s1-q01",
          "type": "mcq",
          "stem": "What is the formula of aluminium oxide?",
          "marks": 1,
          "difficulty": "standard",
          "objective_ids": [
            "LO1"
          ],
          "topic_ids": [
            "notation"
          ],
          "options": [
            {
              "id": "A",
              "text": "\\(\\mathrm{AlO}\\)",
              "feedback": "This would need the charges to be equal and opposite, but an aluminium ion is \\(\\mathrm{Al^{3+}}\\) and an oxide ion is \\(\\mathrm{O^{2-}}\\). One of each leaves an overall charge of 1+, so the formula cannot be \\(\\mathrm{AlO}\\).",
              "misconception": "Pairs one positive ion with one negative ion whatever their charges"
            },
            {
              "id": "B",
              "text": "\\(\\mathrm{Al_2O_3}\\)",
              "feedback": "The formula of aluminium oxide is \\(\\mathrm{Al_2O_3}\\), because two aluminium ions, \\(\\mathrm{Al^{3+}}\\), combine with three oxide ions, \\(\\mathrm{O^{2-}}\\), to give an electrically neutral compound: six positive charges balance six negative charges."
            },
            {
              "id": "C",
              "text": "\\(\\mathrm{Al_3O_2}\\)",
              "feedback": "The numbers are the right ones but they are attached to the wrong elements. Three \\(\\mathrm{Al^{3+}}\\) ions carry nine positive charges and two \\(\\mathrm{O^{2-}}\\) ions carry only four negative charges, so \\(\\mathrm{Al_3O_2}\\) would not be neutral.",
              "misconception": "Swaps the subscripts"
            },
            {
              "id": "D",
              "text": "\\(\\mathrm{Al_2O}\\)",
              "feedback": "Two \\(\\mathrm{Al^{3+}}\\) ions carry six positive charges, but a single \\(\\mathrm{O^{2-}}\\) ion carries only two negative charges. Three oxide ions are needed to balance them, giving \\(\\mathrm{Al_2O_3}\\)."
            }
          ],
          "answer": "B",
          "not_sure": {
            "feedback": "Start from the ions. Aluminium forms \\(\\mathrm{Al^{3+}}\\) and oxygen forms \\(\\mathrm{O^{2-}}\\). Find the smallest numbers of each that make the total positive charge equal the total negative charge."
          },
          "teaching_note": "In an ionic formula the total positive charge equals the total negative charge. The subscripts say how many of each ion are needed: \\(\\mathrm{Al_2O_3}\\) means two \\(\\mathrm{Al^{3+}}\\) for every three \\(\\mathrm{O^{2-}}\\).",
          "worked_solution": "Charge from two aluminium ions: \\(2\\times(+3)=+6\\).\n\nCharge from three oxide ions: \\(3\\times(-2)=-6\\).\n\n\\[(+6)+(-6)=0\\]\n\nThe compound is neutral, so the formula is \\(\\mathrm{Al_2O_3}\\)."
        },
        {
          "id": "s1-q02",
          "type": "mcq",
          "stem": "Which ion does a sodium atom form?",
          "marks": 1,
          "difficulty": "standard",
          "objective_ids": [
            "LO1"
          ],
          "topic_ids": [
            "notation"
          ],
          "options": [
            {
              "id": "A",
              "text": "\\(\\mathrm{Na^+}\\)",
              "feedback": "Sodium is in Group 1 and has one electron in its outer shell. It loses that electron, leaving 11 protons and 10 electrons, so the ion is \\(\\mathrm{Na^+}\\)."
            },
            {
              "id": "B",
              "text": "\\(\\mathrm{Na^-}\\)",
              "feedback": "A negative ion forms when an atom gains electrons. Sodium is a metal with one outer electron, which it loses rather than gains, so it forms \\(\\mathrm{Na^+}\\), not \\(\\mathrm{Na^-}\\).",
              "misconception": "Thinks metals gain electrons"
            },
            {
              "id": "C",
              "text": "\\(\\mathrm{Na^{2+}}\\)",
              "feedback": "A charge of 2+ would mean two electrons had been lost. Sodium has only one electron in its outer shell, so it loses one and forms \\(\\mathrm{Na^+}\\). Magnesium, in Group 2, is the one that forms \\(\\mathrm{Mg^{2+}}\\).",
              "misconception": "Confuses Group 1 and Group 2 charges"
            },
            {
              "id": "D",
              "text": "\\(\\mathrm{Na^{2-}}\\)",
              "feedback": "Both the size and the sign are wrong here. An ion such as \\(\\mathrm{O^{2-}}\\) forms when a non-metal gains two electrons. Sodium is a metal that loses one electron, forming \\(\\mathrm{Na^+}\\)."
            }
          ],
          "answer": "A",
          "not_sure": {
            "feedback": "Use the group number. Sodium is in Group 1, so it has one outer electron. Metals lose their outer electrons, and each electron lost gives one positive charge."
          }
        },
        {
          "id": "s1-q03",
          "type": "true_false",
          "marks": 1,
          "difficulty": "standard",
          "objective_ids": [
            "LO1"
          ],
          "topic_ids": [
            "notation"
          ],
          "stem": "True or false? This equation is balanced.\n\n\\[2\\mathrm{Mg}+\\mathrm{O_2}\\rightarrow2\\mathrm{MgO}\\]",
          "answer": true,
          "feedback": {
            "true": "There are two magnesium atoms on each side, and two oxygen atoms on each side: one \\(\\mathrm{O_2}\\) molecule on the left and two \\(\\mathrm{MgO}\\) on the right. The numbers of each kind of atom match, so the equation is balanced.",
            "false": "Count each kind of atom. On the left there are \\(2\\) magnesium atoms and one \\(\\mathrm{O_2}\\) molecule, which is two oxygen atoms. On the right, \\(2\\mathrm{MgO}\\) contains two magnesium and two oxygen atoms. Both sides match, so the equation is balanced."
          },
          "not_sure": {
            "feedback": "An equation is balanced when each kind of atom appears the same number of times on both sides. The large number in front, as in \\(2\\mathrm{MgO}\\), multiplies everything in that formula. The small number, as in \\(\\mathrm{O_2}\\), counts only the atom it follows."
          }
        },
        {
          "id": "s1-q04",
          "type": "numeric",
          "marks": 1,
          "difficulty": "standard",
          "objective_ids": [
            "LO2"
          ],
          "topic_ids": [
            "maths"
          ],
          "stem": "Calculate the percentage by mass of magnesium in magnesium oxide, \\(\\mathrm{MgO}\\).\n\nRelative atomic masses: \\(\\mathrm{Mg}=24\\), \\(\\mathrm{O}=16\\).",
          "answer": {
            "value": 60,
            "tolerance": {
              "type": "absolute",
              "value": 0.5
            },
            "unit": "%"
          },
          "feedback": {
            "correct": "The relative formula mass of \\(\\mathrm{MgO}\\) is \\(24+16=40\\), and magnesium contributes 24 of that, so the percentage is \\(\\frac{24}{40}\\times100=60\\%\\).",
            "incorrect": "Divide the mass of magnesium in the formula by the relative formula mass of the whole compound, then multiply by 100. The formula mass of \\(\\mathrm{MgO}\\) is \\(24+16=40\\), so the percentage is \\(\\frac{24}{40}\\times100=60\\%\\)."
          },
          "wrong_answers": [
            {
              "value": 40,
              "feedback": "40 is the percentage of oxygen, \\(\\frac{16}{40}\\times100\\). The question asks for magnesium, so the top of the fraction must be 24: \\(\\frac{24}{40}\\times100=60\\%\\).",
              "misconception": "Uses the other element"
            },
            {
              "value": 150,
              "feedback": "150 comes from \\(\\frac{24}{16}\\times100\\), which compares magnesium with oxygen. Compare magnesium with the whole compound instead: \\(\\frac{24}{24+16}\\times100=60\\%\\).",